{
  "protocol_version": "quest.questionnaire.v1",
  "session_id": "brb-session-042",
  "request_id": "f8d62b0a-77e8-4f7d-a7da-7f95fd9a7024",
  "nonce": "b96d9b51c4874db8a4e8f1b4",
  "study_id": "brb",
  "schema_id": "brb-questionnaire-v1",
  "open_stage": "post_condition:pictographic",
  "condition_number": 1,
  "screen_sequence": [
    "post_condition:pictographic",
    "post_condition:presence_questionnaire",
    "post_condition:lost_opportunity"
  ],
  "participant_ref": "P042",
  "caller": {
    "package": "org.thebigredbuttoninstitute.app",
    "app_version": "debug",
    "engine": "unity"
  }
}

